EDR-24680,Leveraged Native OS Function Calls,,leveraged OS functions,Leveraged native OS function calls detected on host SERVER-789,,2022-10-15T08:12:34Z,,,,Medium,"[{'host_name': 'SERVER-789', 'ip_address': '192.168.1.150'}]","{'username': 'jdoe', 'domain': 'MYDOMAIN', 'process_name': 'powershell.exe', 'process_command_line': 'powershell.exe -c ""Get-Process | Select-Object Name,ProcessId""', 'source_ip': '192.168.1.151', 'destination_ip': '192.168.1.150', 'function_calls': ['OpenProcess', 'CreateRemoteThread', 'VirtualAllocEx', 'WriteProcessMemory', 'CreateProcessA', 'CreateProcessW', 'CreateToolhelp32Snapshot', 'GetModuleHandleA', 'GetProcAddress', 'LoadLibraryA', 'LoadLibraryW', 'ShellExecuteA', 'ShellExecuteW']}",,,,,,,,,,,,,,,,,,,,,,,,,,,,,,,,,,,,,,,,,,,,,,,,,,,,,,,,,,,,,,,,,,,,,,,,,,,,,,,,,,,,,,,,,,,,,,,,,,,,,,,,,,,,,,,,,,,,,,,,,,,,,,,,,,,,,,,,,,,,,,,,,,,,,,,,,,,,,,,,,,,,,,,,,,,,,,,,,,,,,,,,,,,,,,,,,,,,,,,,,,,,,,,,,,,,,,,,"event_id is EDR-24680. event_type is Leveraged Native OS Function Calls. event_category is leveraged OS functions. event_description is Leveraged native OS function calls detected on host SERVER-789. event_time is 2022-10-15T08:12:34Z. event_severity is Medium. affected_hosts host_name is SERVER-789. affected_hosts ip_address is 192.168.1.150. event_details username is jdoe. event_details domain is MYDOMAIN. event_details process_name is powershell.exe. event_details process_command_line is powershell.exe -c ""Get-Process | Select-Object Name,ProcessId"". event_details source_ip is 192.168.1.151. event_details destination_ip is 192.168.1.150. event_details function_calls is OpenProcess. event_details function_calls is CreateRemoteThread. event_details function_calls is VirtualAllocEx. event_details function_calls is WriteProcessMemory. event_details function_calls is CreateProcessA. event_details function_calls is CreateProcessW. event_details function_calls is CreateToolhelp32Snapshot. event_details function_calls is GetModuleHandleA. event_details function_calls is GetProcAddress. event_details function_calls is LoadLibraryA. event_details function_calls is LoadLibraryW. event_details function_calls is ShellExecuteA. event_details function_calls is ShellExecuteW. "
02020r444,Masquerade,2023-03-10T19:00:00Z,Masquerading,An attempt to disguise malware as a legitimate application to avoid detection.,high,,,,{'hostname': 'server01'},,,,,,,,,,,,,,,,,,,,,,,,,,,,,,,,,,,,,,,{'reason': 'Process attempted to execute an unauthorized file'},,,,,,,,,,,,,,,,,,,,,{'username': 'user01'},,,,,,,,,,,,,,,,,,,,,,,,,,"{'process_name': 'explorer.exe', 'command_line': 'explorer.exe /c C:\\Windows\\system32\\notepad.exe'}",,,,,,,,,,,,,,,,,,,,,,,,,,,,,,,,,,,,,,,,,,,,,,,,,,,,,,,,,,,,,,,,,,,,,,,,,,,,,,,,,,,,,,,,,,,,,,,,,,,,,,,,,,,,,,,,,,,,,,,,,,,,,,,,,,,,,event_id is 02020r444. event_type is Masquerade. event_timestamp is 2023-03-10T19:00:00Z. event_category is Masquerading. event_description is An attempt to disguise malware as a legitimate application to avoid detection.. severity is high. host hostname is server01. detection reason is Process attempted to execute an unauthorized file. user username is user01. process_execution process_name is explorer.exe. process_execution command_line is explorer.exe /c C:\Windows\system32\notepad.exe. 
03040f0v,modification,2023-03-10T18:00:00Z,registry_modification,An attempt to modify the authentication process to bypass security controls.,critical,,,,{'hostname': 'server01'},,,,,,,,,,,,,,,,,,,,,,,,,,,,,,,,,,,,,,,{'reason': 'Unauthorized modification of registry key'},,,,,,,,,,,,,,,,,,,,,{'username': 'admin01'},,,,,,,,,,,,,,,,,,,,,,,,,,,"{'registry_key': 'HKLM\\SOFTWARE\\Microsoft\\Windows NT\\CurrentVersion\\Winlogon', 'registry_value_name': 'Userinit', 'new_value': '', 'old_value': 'C:\\Windows\\system32\\userinit.exe,'}",,,,,,,,,,,,,,,,,,,,,,,,,,,,,,,,,,,,,,,,,,,,,,,,,,,,,,,,,,,,,,,,,,,,,,,,,,,,,,,,,,,,,,,,,,,,,,,,,,,,,,,,,,,,,,,,,,,,,,,,,,,,,,,,,,,,"event_id is 03040f0v. event_type is modification. event_timestamp is 2023-03-10T18:00:00Z. event_category is registry_modification. event_description is An attempt to modify the authentication process to bypass security controls.. severity is critical. host hostname is server01. detection reason is Unauthorized modification of registry key. user username is admin01. registry_modification registry_key is HKLM\SOFTWARE\Microsoft\Windows NT\CurrentVersion\Winlogon. registry_modification registry_value_name is Userinit. registry_modification new_value is . registry_modification old_value is C:\Windows\system32\userinit.exe,. "
0320r0f,detect,2023-03-10T19:00:00Z,cloud_infrastructure_modification,An attempt to modify cloud compute infrastructure to evade security controls.,critical,,,,{'hostname': 'server01'},,,,,,,,,,,,,,,,,,,,,,,,,,,,,,,,,,,,,,,{'reason': 'Unauthorized modification of cloud compute instance attribute'},,,,,,,,,,,,,,,,,,,,,{'username': 'admin01'},,,,,,,,,,,,,,,,,,,,,,,,,,,,"{'cloud_provider': 'AWS', 'api_operation': 'ModifyInstanceAttribute', 'resource_type': 'EC2 Instance', 'resource_id': 'i-0123456789abcdef', 'modification_details': {'InstanceType': {'old_value': 't2.micro', 'new_value': 't3.micro'}}}",,,,,,,,,,,,,,,,,,,,,,,,,,,,,,,,,,,,,,,,,,,,,,,,,,,,,,,,,,,,,,,,,,,,,,,,,,,,,,,,,,,,,,,,,,,,,,,,,,,,,,,,,,,,,,,,,,,,,,,,,,,,,,,,,,,"event_id is 0320r0f. event_type is detect. event_timestamp is 2023-03-10T19:00:00Z. event_category is cloud_infrastructure_modification. event_description is An attempt to modify cloud compute infrastructure to evade security controls.. severity is critical. host hostname is server01. detection reason is Unauthorized modification of cloud compute instance attribute. user username is admin01. cloud_infrastructure_modification cloud_provider is AWS. cloud_infrastructure_modification api_operation is ModifyInstanceAttribute. cloud_infrastructure_modification resource_type is EC2 Instance. cloud_infrastructure_modification resource_id is i-0123456789abcdef. cloud_infrastructure_modification modification_details InstanceType is {'old_value': 't2.micro', 'new_value': 't3.micro'}. "
dmkslkdk2,threat detection,2022-03-04T10:31:45Z,System Call,Suspicious Use of Native API Detected,high,,,,,,,,,,,,,,,,,,,,,,,,,,,,,,,,Analyze the system for any suspicious activities or processes and block the process that was making the suspicious call.,,,,,,,,,,,,,,,,,,,,,,,,,,,,,,,,,,,,,,,,,,,,,,,,,,,,,,,,,,,,,detect,"CrowdStrike Falcon detected a process using a Native API function to interact with the operating system. The API function is commonly used by malware to execute commands or perform actions on the system, and can be an indicator of malicious activity.",,,,,,,,,,,,,,,,,,,,,,,,,,,,,,,,,,,,,,,,,,,,,,,,,,,,,,,,,,,,,,,,,,,,,,,,,,,,,,,,,,,,,,,,,,,,,,,,,,,,,,,,,,,,,,,,,,,,,,,,,,,,,,,,,"event_id is dmkslkdk2. event_type is threat detection. event_timestamp is 2022-03-04T10:31:45Z. event_category is System Call. event_description is Suspicious Use of Native API Detected. severity is high. recommendation is Analyze the system for any suspicious activities or processes and block the process that was making the suspicious call.. subtype is detect. detection_details is CrowdStrike Falcon detected a process using a Native API function to interact with the operating system. The API function is commonly used by malware to execute commands or perform actions on the system, and can be an indicator of malicious activity.. "
33345,nbb_detection,2022-08-10T12:34:56Z,Network boundary bridging,Adversaries may bridge network boundaries by compromising perimeter network devices or internal devices responsible for network segmentation. Breaching these devices may enable an adversary to bypass restrictions on traffic routing that otherwise separate trusted and untrusted networks.,HIGH,,,,,,,,,,,,,,,,,,,,,,,,,,1.0,,,,,,,,,,,,,,,,,,,,,,,,,,,,,,,,,,,12345678-1234-5678-1234-567812345678,,,,,,,,,,,,,,,,,,,,,,,,,,,,,,,,,,ABCDEF1234567890,"{'computer_name': 'Example-PC', 'process_name': 'explorer.exe', 'process_id': '1234', 'command_line': 'C:\\Windows\\Explorer.exe', 'local_address': '192.168.1.2', 'remote_address': '10.0.0.2', 'remote_port': '80', 'protocol': 'TCP', 'nbb_rule': {'action': 'block', 'direction': 'outbound', 'local_networks': ['192.168.1.0/24'], 'remote_networks': ['10.0.0.0/24'], 'protocols': ['tcp'], 'ports': [80], 'applications': ['explorer.exe']}}",,,,,,,,,,,,,,,,,,,,,,,,,,,,,,,,,,,,,,,,,,,,,,,,,,,,,,,,,,,,,,,,,,,,,,,,,,,,,,,,,,,,,,,,,,,,,,,,,,,,,,,,,,,,,,,,,,,,,,,,,,,,,,,event_id is 33345. event_type is nbb_detection. event_timestamp is 2022-08-10T12:34:56Z. event_category is Network boundary bridging. event_description is Adversaries may bridge network boundaries by compromising perimeter network devices or internal devices responsible for network segmentation. Breaching these devices may enable an adversary to bypass restrictions on traffic routing that otherwise separate trusted and untrusted networks.. severity is HIGH. sensor_id is 12345678-1234-5678-1234-567812345678. customer_id is ABCDEF1234567890. event_info computer_name is Example-PC. event_info process_name is explorer.exe. event_info process_id is 1234. event_info command_line is C:\Windows\Explorer.exe. event_info local_address is 192.168.1.2. event_info remote_address is 10.0.0.2. event_info remote_port is 80. event_info protocol is TCP. event_info nbb_rule action is block. event_info nbb_rule direction is outbound. event_info nbb_rule local_networks is ['192.168.1.0/24']. event_info nbb_rule remote_networks is ['10.0.0.0/24']. event_info nbb_rule protocols is ['tcp']. event_info nbb_rule ports is [80]. event_info nbb_rule applications is ['explorer.exe']. 
1234567890,,2022-03-09T10:42:11.000Z,Denial of Service,Crowdstrike Falcon has detected a network denial of service (DoS) attack on the endpoint.,high,,,,,,,,,,,,,,,,,,,,,,,,,,,,,"{'hostname': 'COMPANY-PC01', 'ip_address': '192.168.1.101', 'os': 'Windows 10 Pro', 'domain': 'company.local'}",,,,,,,,,,,,,,,,,,,,,,,,,,,,,,,,,,,,,,,,,,,,,,,,,,,,,,,,,,,,,,,,,,,,Crowdstrike Falcon,"{'technique_id': 'T1498', 'technique_name': 'Network Denial of Service', 'subtechnique_id': '', 'subtechnique_name': ''}","{'source_ip': '10.0.0.2', 'destination_ip': '192.168.1.101', 'attack_type': 'UDP Flood', 'attack_duration': '120 seconds', 'affected_services': 'HTTP, DNS, FTP'}",,,,,,,,,,,,,,,,,,,,,,,,,,,,,,,,,,,,,,,,,,,,,,,,,,,,,,,,,,,,,,,,,,,,,,,,,,,,,,,,,,,,,,,,,,,,,,,,,,,,,,,,,,,,,,,,,,,,,,,,,,,,"event_id is 1234567890. event_timestamp is 2022-03-09T10:42:11.000Z. event_category is Denial of Service. event_description is Crowdstrike Falcon has detected a network denial of service (DoS) attack on the endpoint.. severity is high. endpoint hostname is COMPANY-PC01. endpoint ip_address is 192.168.1.101. endpoint os is Windows 10 Pro. endpoint domain is company.local. product is Crowdstrike Falcon. mitre technique_id is T1498. mitre technique_name is Network Denial of Service. mitre subtechnique_id is . mitre subtechnique_name is . attack_details source_ip is 10.0.0.2. attack_details destination_ip is 192.168.1.101. attack_details attack_type is UDP Flood. attack_details attack_duration is 120 seconds. attack_details affected_services is HTTP, DNS, FTP. "
3344567,alert,2023-03-09T12:00:00.000000Z,non standard port,,,,,,,high,,,,,,Non-Standard Port,,,TCP,,curl.exe,,,,,,,C:\Windows\System32\cmd.exe,,,,,,,,,,,,,,,,192.168.1.100,10.0.0.2,,,,,,,,,,,,,,Command and Control,,1234.0,,,,,,,,DOMAIN\user,,C:\Program Files\curl\curl.exe https://example.com:12345,,cmd.exe,,,,,,,,,,,,,,,,,,,,,,,,,,,,,,,,Non-Standard Port,12345.0,5678.0,,,,,,,,,,,,,,,,,,,,,,,,,,,,,,,,,,,,,,,,,,,,,,,,,,,,,,,,,,,,,,,,,,,,,,,,,,,,,,,,,,,,,,,,,,,,,,,,,,,,,,,,,,,,,,,,,,,,,,,,,event_id is 3344567. event_type is alert. event_timestamp is 2023-03-09T12:00:00.000000Z. event_category is non standard port. event_severity is high. technique is Non-Standard Port. protocol is TCP. process_name is curl.exe. parent_process_command_line is C:\Windows\System32\cmd.exe. source_ip is 192.168.1.100. destination_ip is 10.0.0.2. tactic is Command and Control. user is DOMAIN\user. process_command_line is C:\Program Files\curl\curl.exe https://example.com:12345. parent_process_name is cmd.exe. description is Non-Standard Port. 
T1566,,2023-03-04T13:45:30Z,Phishing,An email phishing attempt has been detected.,,,,,"{'hostname': 'endpoint-01', 'ip_address': '192.168.1.10', 'os': 'Windows 10', 'process_name': 'outlook.exe', 'process_commandline': '""C:\\Program Files\\Microsoft Office\\Office16\\OUTLOOK.EXE""', 'process_id': '1234'}",High,,,,,,,,,,,,,,,,,,,,,,,,,,,,,,,,,,,,,,,,,,,,,,,,,,,,,,,,,,,"{'username': 'johndoe', 'display_name': 'John Doe', 'email_address': 'johndoe@example.com', 'user_agent': 'Microsoft Outlook', 'ip_address': '192.168.1.20'}",,,,,,,,,,,threat,,,,,,,,,,,,,,,,,,,,,,,,,,,,spoofed@example.com,johndoe@example.com,Important: Action Required,"['http://malicious.com', 'http://phishing.com']",['invoice.pdf'],,,,,,,,,,,,,,,,,,,,,,,,,,,,,,,,,,,,,,,,,,,,,,,,,,,,,,,,,,,,,,,,,,,,,,,,,,,,,,,,,,,,,,,,,,,,,,,,,,,,,,,,,,,,,,,,,,,,"event_id is T1566. event_timestamp is 2023-03-04T13:45:30Z. event_category is Phishing. event_description is An email phishing attempt has been detected.. host hostname is endpoint-01. host ip_address is 192.168.1.10. host os is Windows 10. host process_name is outlook.exe. host process_commandline is ""C:\Program Files\Microsoft Office\Office16\OUTLOOK.EXE"". host process_id is 1234. event_severity is High. user username is johndoe. user display_name is John Doe. user email_address is johndoe@example.com. user user_agent is Microsoft Outlook. user ip_address is 192.168.1.20. type is threat. email_sender is spoofed@example.com. email_recipient is johndoe@example.com. email_subject is Important: Action Required. email_urls are http://malicious.com; http://phishing.com; email_attachments are invoice.pdf; "
T1566,,,Plist File Modification,A suspicious modification has been detected in a plist file.,,,,,,,,,,,,,,,,,,,,,,,,,,,,,,,,,,,,,,,,,,,,,,,,,,,,,,,,,,,,,,,,,,,,,,,,,,,,,,,,,,,,,,,,,,,,,,,,,,,,,,,,,,,,,High,2023-03-10T11:15:00Z,hostname123,/Library/LaunchDaemons/com.apple.plist,CrowdStrike Falcon,Investigate the nature and purpose of the plist modification and remediate accordingly.,,,,,,,,,,,,,,,,,,,,,,,,,,,,,,,,,,,,,,,,,,,,,,,,,,,,,,,,,,,,,,,,,,,,,,,,,,,,,,,,,,,,,,,,,,,,,,,,,,,,,,,,,,,,,,event_id is T1566. event_category is Plist File Modification. event_description is A suspicious modification has been detected in a plist file.. Severity is High. event_Timestamp is 2023-03-10T11:15:00Z. Affected_Hostname is hostname123. Affected_File_Path is /Library/LaunchDaemons/com.apple.plist. Alert_Source is CrowdStrike Falcon. Recommendation is Investigate the nature and purpose of the plist modification and remediate accordingly.. 
T1566,,2023-03-10T12:00:00Z,suspicious pre-OS boot imagex,A suspicious pre-OS boot image has been detected.,,,,,,,,,,,,,,,,,,,,,,,,,,,,,,,,,,,,,,,,,,,,,,,,,,,,,,,,,,,,2023-03-04T13:45:30Z,,,,,,,,,,,,,,,,threat,,,,,,,,,,,,,,,,,,,,,,,,,,,,,,,,,Critical,,hostname123,,CrowdStrike Falcon,Isolate the affected host and perform a forensic analysis of the pre-OS boot image to determine the nature and purpose of the modification.,Pre-OS Boot,Persistence,Pre-OS Boot,C:\Windows\System32\bootmgr,,,,,,,,,,,,,,,,,,,,,,,,,,,,,,,,,,,,,,,,,,,,,,,,,,,,,,,,,,,,,,,,,,,,,,,,,,,,,,,,,,,,,,,,,,,,,,,,,,,,,,,,,,event_id is T1566. event_timestamp is 2023-03-10T12:00:00Z. event_category is suspicious pre-OS boot imagex. event_description is A suspicious pre-OS boot image has been detected.. timestamp is 2023-03-04T13:45:30Z. type is threat. Severity is Critical. Affected_Hostname is hostname123. Alert_Source is CrowdStrike Falcon. Recommendation is Isolate the affected host and perform a forensic analysis of the pre-OS boot image to determine the nature and purpose of the modification.. Title is Pre-OS Boot. Tactic is Persistence. Technique is Pre-OS Boot. Affected_Image_Path is C:\Windows\System32\bootmgr. 
EDR-13579,Private Key Intercept,,privaqte key interception,Private key intercepted on host WEB-123,,2022-10-31T23:45:01Z,,,,Critical,"[{'host_name': 'WEB-123', 'ip_address': '192.168.1.150'}]","{'username': 'webadmin', 'domain': 'MYDOMAIN', 'source_ip': '192.168.1.151', 'destination_ip': '192.168.1.150', 'private_key_path': 'C:\\Users\\webadmin\\.ssh\\id_rsa'}",,,,,,,,,,,,,,,,,,,,,,,,,,,,,,,,,,,,,,,,,,,,,,,,,,,,,,,,,,,,,,,,,,,,,,,,,,,,,,,,,,,,,,,,,,,,,,,,,,,,,,,,,,,,,,,,,,,,,,,,,,,,,,,,,,,,,,,,,,,,,,,,,,,,,,,,,,,,,,,,,,,,,,,,,,,,,,,,,,,,,,,,,,,,,,,,,,,,,,,,,,,,,,,,,,,,,,,,event_id is EDR-13579. event_type is Private Key Intercept. event_category is privaqte key interception. event_description is Private key intercepted on host WEB-123. event_time is 2022-10-31T23:45:01Z. event_severity is Critical. affected_hosts host_name is WEB-123. affected_hosts ip_address is 192.168.1.150. event_details username is webadmin. event_details domain is MYDOMAIN. event_details source_ip is 192.168.1.151. event_details destination_ip is 192.168.1.150. event_details private_key_path is C:\Users\webadmin\.ssh\id_rsa. 
12345,alert,2023-03-10T13:30:00Z,Process Injection,A suspicious process injection has been detected.,,,,,,,,,,,,,,,,,,,,,,,,,,,,,,,,,,,,,,,,,,,,,,,,,,,,,,,,,,,,,,,,,,,,,,,,,,,,,,,,,,,,,,,,,,,,,,,,,,,,,,,,,,,,,High,,hostname123,,CrowdStrike Falcon,Investigate the injected process and parent process to determine the nature and purpose of the injection and remediate accordingly.,,,,,explorer.exe,notepad.exe,Thread Execution Hijacking,,,,,,,,,,,,,,,,,,,,,,,,,,,,,,,,,,,,,,,,,,,,,,,,,,,,,,,,,,,,,,,,,,,,,,,,,,,,,,,,,,,,,,,,,,,,,,,,,,,,,,,event_id is 12345. event_type is alert. event_timestamp is 2023-03-10T13:30:00Z. event_category is Process Injection. event_description is A suspicious process injection has been detected.. Severity is High. Affected_Hostname is hostname123. Alert_Source is CrowdStrike Falcon. Recommendation is Investigate the injected process and parent process to determine the nature and purpose of the injection and remediate accordingly.. Injected_Process_Name is explorer.exe. Parent_Process_Name is notepad.exe. Injection_Technique is Thread Execution Hijacking. 
939495555,threat_detection,2023-03-09T15:30:00Z,protocol_tunneling,,high,,,,,,,,,,,,,,,,,,,,,,,,,,1.0,,,,,,,,,,,,,,,,,,,,,,,,,,,,,,,,,,,,,,,,,,,,,,,,,,,,,,,,,,,,"['Endpoint1', 'Endpoint2']",,,,,,,,,,,,,,Detection of protocol tunneling activity,,,,,,,,,,,,,,,,,,,,,"['192.168.1.10', '10.0.0.2']","['Isolate affected endpoints', 'Investigate network traffic']",Protocol: HTTP over DNS,,,,,,,,,,,,,,,,,,,,,,,,,,,,,,,,,,,,,,,,,,,,,,,,,,,,,,,,,,,,,,,,,,,,,,,,,,,,,,,,,,,,,,,,,,,,,,,,,,,,event_id is 939495555. event_type is threat_detection. event_timestamp is 2023-03-09T15:30:00Z. event_category is protocol_tunneling. severity is high. affected_entities are Endpoint1; Endpoint2; description is Detection of protocol tunneling activity. indicators are 192.168.1.10; 10.0.0.2; actions are Isolate affected endpoints; Investigate network traffic; additional_info is Protocol: HTTP over DNS. 
12345,detect,2023-03-09T15:45:00Z,proxy,Detection of a connection being made through a proxy,,,,,,high,,,,,,T1090 - Proxy,,,,,,,,,,,,,Proxy Detection,"['Investigate the use of a proxy in the environment', 'Identify the source and destination of the proxy traffic', 'Monitor for any further suspicious activity']",,,,,,,,,,,,,,,,,,,,,,,,,,,,,Defense Evasion,,,,,,,,,,,,,,,,,,Network Traffic,,,,,,,,,,,,,,,,,,,,,,,,,,,,,,,,,,,,,,,,,,,,,,,,,,,,"{'file_name': 'cmd.exe', 'file_path': 'C:\\Windows\\System32\\cmd.exe', 'file_hash': '1a2b3c4d5e6f7g8h9i0j'}","{'destination_ip': '1.2.3.4', 'destination_domain': 'example.com', 'protocol': 'TCP'}",,,,,,,,,,,,,,,,,,,,,,,,,,,,,,,,,,,,,,,,,,,,,,,,,,,,,,,,,,,,,,,,,,,,,,,,,,,,,,,,,,,,,,,,,,,,,,,,,,event_id is 12345. event_type is detect. event_timestamp is 2023-03-09T15:45:00Z. event_category is proxy. event_description is Detection of a connection being made through a proxy. event_severity is high. technique is T1090 - Proxy. detection_method is Proxy Detection. recommended_actions are Investigate the use of a proxy in the environment; Identify the source and destination of the proxy traffic; Monitor for any further suspicious activity; tactic is Defense Evasion. detection_source is Network Traffic. file_info file_name is cmd.exe. file_info file_path is C:\Windows\System32\cmd.exe. file_info file_hash is 1a2b3c4d5e6f7g8h9i0j. network_info destination_ip is 1.2.3.4. network_info destination_domain is example.com. network_info protocol is TCP. 
EDR-67890,Remote Administration Tool,,RA Admin,RAdmin tool used to remotely control workstation WS-456,,2022-11-30T12:34:56Z,,,,High,"[{'host_name': 'SERVER-123', 'ip_address': '192.168.1.200'}]","{'username': 'admin', 'domain': 'MYDOMAIN', 'source_ip': '192.168.1.201', 'destination_ip': '192.168.1.200', 'remote_tool': 'RAdmin'}",,,,,,,,,,,,,,,,,,,,,,,,,,,,,,,,,,,,,,,,,,,,,,,,,,,,,,,,,,,,,,,,,,,,,,,,,,,,,,,,,,,,,,,,,,,,,,,,,,,,,,,,,,,,,,,,,,,,,,,,,,,,,,,,,,,,,,,,,,,,,,,,,,,,,,,,,,,,,,,,,,,,,,,,,,,,,,,,,,,,,,,,,,,,,,,,,,,,,,,,,,,,,,,,,,,,,,,,event_id is EDR-67890. event_type is Remote Administration Tool. event_category is RA Admin. event_description is RAdmin tool used to remotely control workstation WS-456. event_time is 2022-11-30T12:34:56Z. event_severity is High. affected_hosts host_name is SERVER-123. affected_hosts ip_address is 192.168.1.200. event_details username is admin. event_details domain is MYDOMAIN. event_details source_ip is 192.168.1.201. event_details destination_ip is 192.168.1.200. event_details remote_tool is RAdmin. 
12345,alert,1646749655000,Reflective Code Loading,,,,,,,,,,,,,,,,,,,,,,,,,,,,,,,,,,,,,,,,,,,,,,,,,,,,,,,,,,,,,,,,,,,,,,,,,,,,,,,,,,,,,,,,,,,,,,,,,,,,,,,,,,,,,,High,,hostname123,,,Investigate the injected process and loader process to determine the nature and purpose of the reflective code loading activity and remediate accordingly.,,,,,explorer.exe,,,,,,,,2023-03-10T15:45:00Z,A suspicious reflective code loading activity has been detected.,notepad.exe,Reflective DLL Injection,CrowdStrike Falcon,,,,,,,,,,,,,,,,,,,,,,,,,,,,,,,,,,,,,,,,,,,,,,,,,,,,,,,,,,,,,,,,,,,,,,,,,,,,,,,,,,,,,,,,,,,,,event_id is 12345. event_type is alert. event_timestamp is 1646749655000. event_category is Reflective Code Loading. Severity is High. Affected_Hostname is hostname123. Recommendation is Investigate the injected process and loader process to determine the nature and purpose of the reflective code loading activity and remediate accordingly.. Injected_Process_Name is explorer.exe. Timestamp is 2023-03-10T15:45:00Z. Description is A suspicious reflective code loading activity has been detected.. Loader_Process_Name is notepad.exe. Loader_Technique is Reflective DLL Injection. event_Source is CrowdStrike Falcon. 
123456789,threat,,Process/Service Stop,Suspicious Service Stop detected,high,2022-03-06T10:30:00Z,,,,,,,,,,,,,,,,,,,,,,,,,,,,,,,,,,,,,,,,,,,,,,,,,,,,,,,,,,,,,,,,,,,,,,,,,,,,,,,,,,,,,"[{'entity_name': 'ServiceName', 'entity_value': 'SuspiciousServiceName'}, {'entity_name': 'ProcessName', 'entity_value': 'C:\\Windows\\System32\\services.exe'}, {'entity_name': 'ProcessCommandLine', 'entity_value': 'services.exe stop SuspiciousServiceName'}]",,,,,,,,,,,,,,,,,,,,,,,,,,,,,,,,,,,,,,,,,,,,,Defense Evasion,"['Investigate the reason for the suspicious stop of the service.', ""Review the service's configuration to ensure it is properly configured."", 'Monitor for any further suspicious activity.']",,,,,,,,,,,,,,,,,,,,,,,,,,,,,,,,,,,,,,,,,,,,,,,,,,,,,,,,,,,,,,,,,,,,,,,,,,,,,,,,,,,,,,,,,,,event_id is 123456789. event_type is threat. event_category is Process/Service Stop. event_description is Suspicious Service Stop detected. severity is high. event_time is 2022-03-06T10:30:00Z. affected_entities entity_name is ServiceName. affected_entities entity_value is SuspiciousServiceName. affected_entities entity_name is ProcessName. affected_entities entity_value is C:\Windows\System32\services.exe. affected_entities entity_name is ProcessCommandLine. affected_entities entity_value is services.exe stop SuspiciousServiceName. tactics is Defense Evasion. recommendations are Investigate the reason for the suspicious stop of the service.; Review the service's configuration to ensure it is properly configured.; Monitor for any further suspicious activity.; 
12345,threat detection,1646749655000,Suspicious Shared Module Loaded,Adversaries may execute malicious payloads via loading shared modules.,,,,,,,,,,,,,,,,,,,,,,,,,,,,,,,,,,,,,,,,,,,,,,,,,,,,,,,,,,,,,,12345678,mycomputer,,,mydomain.local,,,,,,,,,,THREAT,,,,,,,,,,,,,,,,,,,,123456,,,,,,,,,,,,,,,,,,,,,,,,,,,,,,,,,,,,,,"['192.168.1.100', 'fe80::1234:5678:90ab:cdef']",['00:11:22:33:44:55'],Windows 10,6.30.0.0,Workstations,,,,,,,,,,,,,,,,,,,,,,,,,,,,,,,,,,,,,,,,,,,,,,,,,,,,,,,,,,,,,,,,,,,,,,,,,,,,,,,,,,,,,,event_id is 12345. event_type is threat detection. event_timestamp is 1646749655000. event_category is Suspicious Shared Module Loaded. event_description is Adversaries may execute malicious payloads via loading shared modules.. sensor_id is 12345678. hostname is mycomputer. domain is mydomain.local. type is THREAT. customer_id is 123456. ip_addresses are 192.168.1.100; fe80::1234:5678:90ab:cdef; mac_addresses are 00:11:22:33:44:55; operating_system is Windows 10. agent_version is 6.30.0.0. group_name is Workstations. 
